A1: Risultati dell'esonero del 18 aprile 2002
A3: NOME | B3: ES 1 | C3: ES 2 | D3: ES 3 | E3: ES 4 | F3: ES 5 | G3: ES 6 | H3: TOTALE | I3: Voto
A4: ADAMI GEMMA | B4: 16 | D4: 7 | E4: 3 | F4: 8 | G4: 12 | H4: =SUM(B4:G4) -> 46 | I4: 25
A5: ALLEGRETTI ANDREA | B5: 6 | C5: 2 | D5: 7 | E5: 3 | F5: 8 | G5: 3 | H5: =SUM(B5:G5) -> 29 | I5: 18
A6: BENEDETTI FULVIO | B6: 10 | E6: 3 | F6: 8 | G6: 9 | H6: =SUM(B6:G6) -> 30 | I6: 19
A7: BLASI LUCIANO | D7: 14 | E7: 3 | F7: 8 | G7: 12 | H7: =SUM(B7:G7) -> 37 | I7: 21
A8: BONIFACI VINCENZO | B8: 18 | C8: 14 | D8: 16 | E8: 6 | F8: 8 | G8: 12 | H8: =SUM(B8:G8) -> 74 | I8: 30+
A9: BOSELLO MASSIMO | B9: 16 | C9: 14 | D9: 4 | E9: 3 | F9: 8 | G9: 12 | H9: =SUM(B9:G9) -> 57 | I9: 29
A10: CANESTRELLI DANIELE | B10: 10 | C10: 12 | D10: 14 | E10: 3 | F10: 8 | G10: 12 | H10: =SUM(B10:G10) -> 59 | I10: 30
A11: CARBONE CORRADO | B11: 8 | E11: 3 | F11: 2 | G11: 10 | H11: =SUM(B11:G11) -> 23 | I11: 16
A12: CARRIERO FRANCESCO | B12: 12 | C12: 1 | D12: 6 | E12: 3 | F12: 7 | G12: 12 | H12: =SUM(B12:G12) -> 41 | I12: 23
A13: COTTEFOGLIE FABIO | B13: 10 | C13: 14 | D13: 13 | E13: 3 | G13: 12 | H13: =SUM(B13:G13) -> 52 | I13: 27
A14: DE PAULIS ANGELA | B14: 12 | C14: 8 | E14: 3 | F14: 8 | G14: 12 | H14: =SUM(B14:G14) -> 43 | I14: 24
A15: DI DONATO MARCO | B15: 14 | D15: 13 | E15: 3 | F15: 7 | G15: 12 | H15: =SUM(B15:G15) -> 49 | I15: 26
A16: DI FELICE EMANUEL | B16: 12 | D16: 3 | E16: 3 | F16: 0 | G16: 3 | H16: =SUM(B16:G16) -> 21 | I16: 15
A17: FORIN MARCO | B17: 16 | C17: 13 | D17: 13 | E17: 3 | F17: 3 | G17: 12 | H17: =SUM(B17:G17) -> 60 | I17: 30
A18: FRIJA MASSIMO | B18: 16 | C18: 4 | D18: 13 | E18: 3 | F18: 0 | G18: 12 | H18: =SUM(B18:G18) -> 48 | I18: 26
A19: GAETA EUGENIO | C19: 8 | D19: 10 | E19: 3 | F19: 6 | G19: 12 | H19: =SUM(B19:G19) -> 39 | I19: 22
A20: GIANNONE CRISTINA | B20: 8 | C20: 0 | D20: 0 | E20: 3 | F20: 0 | G20: 6 | H20: =SUM(B20:G20) -> 17 | I20: 14
A21: GUERRINI FABRIZIO | B21: 14 | D21: 8 | E21: 3 | F21: 0 | G21: 12 | H21: =SUM(B21:G21) -> 37 | I21: 21
A22: LOMBARDI ALESSANDRO | B22: 16 | C22: 4 | D22: 15 | E22: 3 | F22: 7 | G22: 12 | H22: =SUM(B22:G22) -> 57 | I22: 29
A23: MACRI' FRANCESCO | B23: 2 | C23: 2 | D23: 2 | E23: 3 | F23: 4 | G23: 12 | H23: =SUM(B23:G23) -> 25 | I23: 17
A24: MANNUCCI FABRIZIO | B24: 16 | D24: 7 | E24: 6 | F24: 8 | G24: 12 | H24: =SUM(B24:G24) -> 49 | I24: 26
A25: MARROCCELLI ALFREDO | B25: 18 | D25: 17 | E25: 3 | F25: 8 | G25: 12 | H25: =SUM(B25:G25) -> 58 | I25: 29
A26: MIGLIORI DAMIANO | C26: 10 | D26: 14 | E26: 3 | F26: 8 | G26: 12 | H26: =SUM(B26:G26) -> 47 | I26: 25
A27: MINORI FLAVIO | B27: 10 | D27: 9 | E27: 3 | F27: 8 | G27: 12 | H27: =SUM(B27:G27) -> 42 | I27: 23
A28: MORICI ANDREA | B28: 10 | C28: 12 | D28: 17 | E28: 3 | G28: 4 | H28: =SUM(B28:G28) -> 46 | I28: 25
A29: PAGGI PATRIZIO | B29: 8 | C29: 12 | D29: 16 | E29: 3 | F29: 8 | G29: 12 | H29: =SUM(B29:G29) -> 59 | I29: 30
A30: PANTALEONI LANFRANCO | B30: 10 | C30: 6 | D30: 12 | E30: 3 | F30: 8 | G30: 12 | H30: =SUM(B30:G30) -> 51 | I30: 27
A31: PARTENOPE DARIO | B31: 16 | D31: 9 | E31: 5 | F31: 8 | G31: 12 | H31: =SUM(B31:G31) -> 50 | I31: 26
A32: PATRIZI FABIO | B32: 10 | C32: 8 | D32: 17 | G32: 12 | H32: =SUM(B32:G32) -> 47 | I32: 25
A33: PERSI FRANCESCA | B33: 16 | D33: 17 | E33: 0 | F33: 8 | G33: 12 | H33: =SUM(B33:G33) -> 53 | I33: 27
A34: POGGI ANTONELLA | B34: 6 | D34: 13 | E34: 6 | G34: 6 | H34: =SUM(B34:G34) -> 31 | I34: 19
A35: POLILLI EMIDIO | B35: 14 | D35: 11 | E35: 3 | F35: 8 | G35: 12 | H35: =SUM(B35:G35) -> 48 | I35: 26
A36: PROIETTI ANGELO | C36: 1 | D36: 6 | E36: 3 | F36: 8 | G36: 12 | H36: =SUM(B36:G36) -> 30 | I36: 19
A37: PUCCIO GIUSEPPE | B37: 16 | C37: 7 | D37: 14 | E37: 3 | F37: 8 | G37: 12 | H37: =SUM(B37:G37) -> 60 | I37: 30
A38: QUERZONI LEONARDO | B38: 14 | D38: 17 | E38: 0 | F38: 8 | G38: 10 | H38: =SUM(B38:G38) -> 49 | I38: 26
A39: RAFFALDI ELISA VALERIA | B39: 14 | D39: 12 | E39: 3 | F39: 8 | G39: 11 | H39: =SUM(B39:G39) -> 48 | I39: 26
A40: RICCI ERNESTO | B40: 18 | C40: 2 | D40: 14 | E40: 3 | F40: 8 | G40: 12 | H40: =SUM(B40:G40) -> 57 | I40: 29
A41: ROSSINI TERESA | B41: 12 | D41: 2 | E41: 3 | F41: 8 | G41: 12 | H41: =SUM(B41:G41) -> 37 | I41: 21
A42: RUGGERO DARIO | B42: 16 | D42: 6 | E42: 3 | F42: 8 | G42: 12 | H42: =SUM(B42:G42) -> 45 | I42: 24
A43: SABBATINI GUIDO | B43: 14 | C43: 12 | D43: 0 | E43: 6 | F43: 8 | G43: 12 | H43: =SUM(B43:G43) -> 52 | I43: 27
A44: SALUZ FEDERICO | B44: 12 | D44: 2 | E44: 0 | F44: 0 | H44: =SUM(B44:G44) -> 14 | I44: 13
A45: TAGLIAMONTE CRISTIANO | B45: 2 | D45: 16 | F45: 8 | G45: 12 | H45: =SUM(B45:G45) -> 38 | I45: 22
A46: TERELLA DAVIDE | B46: 14 | D46: 12 | E46: 0 | F46: 8 | G46: 12 | H46: =SUM(B46:G46) -> 46 | I46: 25
A47: TRANQUILLI SALVATORE | B47: 14 | C47: 7 | F47: 7 | G47: 12 | H47: =SUM(B47:G47) -> 40 | I47: 23
A48: UGUAZIO GIORGIO | B48: 12 | C48: 14 | D48: 17 | E48: 6 | F48: 8 | G48: 9 | H48: =SUM(B48:G48) -> 66 | I48: 30+
A49: VACCARO DOMENICO | B49: 15 | D49: 10 | E49: 3 | F49: 8 | G49: 12 | H49: =SUM(B49:G49) -> 48 | I49: 26
A50: VALENZA ROMINA | B50: 4 | D50: 9 | E50: 0 | F50: 8 | G50: 12 | H50: =SUM(B50:G50) -> 33 | I50: 20
A51: ZIPARO VITTORIO AMOS | B51: 16 | C51: 14 | D51: 15 | E51: 3 | F51: 6 | G51: 12 | H51: =SUM(B51:G51) -> 66 | I51: 30+
A52: ZONA MARCO | B52: 10 | D52: 15 | E52: 3 | F52: 8 | G52: 12 | H52: =SUM(B52:G52) -> 48 | I52: 26