A1: Risultati complessivi delle prove scritte e ammissione all'orale
A3: NOME | B3: Primo esonero | C3: Secondo esonero | D3: Media | E3: Ammesso all'orale
A4: ADAMI GEMMA | B4: 24.8 | C4: 25.5 | D4: =ROUND(IF(B4>C4,(B4+C4)/2,(2*B4+3*C4)/5),1) -> 25.2 | E4: SI
A5: ALLEGRETTI ANDREA | B5: 18.4 | C5: 30.8 | D5: =ROUND(IF(B5>C5,(B5+C5)/2,(2*B5+3*C5)/5),1) -> 25.8 | E5: SI
A6: BENEDETTI FULVIO | B6: 18.8 | C6: - | D6: - | E6: -
A7: BLASI LUCIANO | B7: 21.4 | C7: 22.9 | D7: =ROUND(IF(B7>C7,(B7+C7)/2,(2*B7+3*C7)/5),1) -> 22.3 | E7: SI
A8: BONIFACI VINCENZO | B8: 35.3 | C8: 30 | D8: =ROUND(IF(B8>C8,(B8+C8)/2,(2*B8+3*C8)/5),1) -> 32.7 | E8: SI
A9: BOSELLO MASSIMO | B9: 28.9 | C9: 29.6 | D9: =ROUND(IF(B9>C9,(B9+C9)/2,(2*B9+3*C9)/5),1) -> 29.3 | E9: SI
A10: CANESTRELLI DANIELE | B10: 29.6 | C10: 26.6 | D10: =ROUND(IF(B10>C10,(B10+C10)/2,(2*B10+3*C10)/5),1) -> 28.1 | E10: SI
A11: CARBONE CORRADO | B11: 16.1 | C11: 25.9 | D11: =ROUND(IF(B11>C11,(B11+C11)/2,(2*B11+3*C11)/5),1) -> 22 | E11: SI
A12: CARRIERO FRANCESCO | B12: 22.9 | C12: 22.5 | D12: =ROUND(IF(B12>C12,(B12+C12)/2,(2*B12+3*C12)/5),1) -> 22.7 | E12: SI
A13: COTTEFOGLIE FABIO | B13: 27 | C13: 24.8 | D13: =ROUND(IF(B13>C13,(B13+C13)/2,(2*B13+3*C13)/5),1) -> 25.9 | E13: SI
A14: DE PAULIS ANGELA | B14: 23.6 | C14: 24 | D14: =ROUND(IF(B14>C14,(B14+C14)/2,(2*B14+3*C14)/5),1) -> 23.8 | E14: SI
A15: DI DONATO MARCO | B15: 25.9 | C15: 27.4 | D15: =ROUND(IF(B15>C15,(B15+C15)/2,(2*B15+3*C15)/5),1) -> 26.8 | E15: SI
A16: DI FELICE EMANUEL | B16: 15.4 | C16: 21.4 | D16: =ROUND(IF(B16>C16,(B16+C16)/2,(2*B16+3*C16)/5),1) -> 19 | E16: SI
A17: FORIN MARCO | B17: 30 | C17: 32.6 | D17: =ROUND(IF(B17>C17,(B17+C17)/2,(2*B17+3*C17)/5),1) -> 31.6 | E17: SI
A18: FRIJA MASSIMO | B18: 25.5 | C18: 27.4 | D18: =ROUND(IF(B18>C18,(B18+C18)/2,(2*B18+3*C18)/5),1) -> 26.6 | E18: SI
A19: GAETA EUGENIO | B19: 22.1 | C19: 25.9 | D19: =ROUND(IF(B19>C19,(B19+C19)/2,(2*B19+3*C19)/5),1) -> 24.4 | E19: SI
A20: GIANNONE CRISTINA | B20: 13.9 | C20: 18.8 | D20: =ROUND(IF(B20>C20,(B20+C20)/2,(2*B20+3*C20)/5),1) -> 16.8 | E20: NO
A21: GUERRINI FABRIZIO | B21: 21.4 | C21: 28.1 | D21: =ROUND(IF(B21>C21,(B21+C21)/2,(2*B21+3*C21)/5),1) -> 25.4 | E21: SI
A22: LOMBARDI ALESSANDRO | B22: 28.9 | C22: 32.6 | D22: =ROUND(IF(B22>C22,(B22+C22)/2,(2*B22+3*C22)/5),1) -> 31.1 | E22: SI
A23: MACRI' FRANCESCO | B23: 16.9 | C23: - | D23: - | E23: -
A24: MANNUCCI FABRIZIO | B24: 25.9 | C24: 19.5 | D24: =ROUND(IF(B24>C24,(B24+C24)/2,(2*B24+3*C24)/5),1) -> 22.7 | E24: SI
A25: MARROCCELLI ALFREDO | B25: 29.3 | C25: 26.3 | D25: =ROUND(IF(B25>C25,(B25+C25)/2,(2*B25+3*C25)/5),1) -> 27.8 | E25: SI
A26: MIGLIORI DAMIANO | B26: 25.1 | C26: 30.4 | D26: =ROUND(IF(B26>C26,(B26+C26)/2,(2*B26+3*C26)/5),1) -> 28.3 | E26: SI
A27: MINORI FLAVIO | B27: 23.3 | C27: 26.3 | D27: =ROUND(IF(B27>C27,(B27+C27)/2,(2*B27+3*C27)/5),1) -> 25.1 | E27: SI
A28: MORICI ANDREA | B28: 24.8 | C28: 22.1 | D28: =ROUND(IF(B28>C28,(B28+C28)/2,(2*B28+3*C28)/5),1) -> 23.5 | E28: SI
A29: PAGGI PATRIZIO | B29: 29.6 | C29: 24 | D29: =ROUND(IF(B29>C29,(B29+C29)/2,(2*B29+3*C29)/5),1) -> 26.8 | E29: SI
A30: PANTALEONI LANFRANCO | B30: 26.6 | C30: 24.4 | D30: =ROUND(IF(B30>C30,(B30+C30)/2,(2*B30+3*C30)/5),1) -> 25.5 | E30: SI
A31: PARTENOPE DARIO | B31: 26.3 | C31: 21.8 | D31: =ROUND(IF(B31>C31,(B31+C31)/2,(2*B31+3*C31)/5),1) -> 24.1 | E31: SI
A32: PATRIZI FABIO | B32: 25.1 | C32: 30 | D32: =ROUND(IF(B32>C32,(B32+C32)/2,(2*B32+3*C32)/5),1) -> 28 | E32: SI
A33: PERSI FRANCESCA | B33: 27.4 | C33: 28.1 | D33: =ROUND(IF(B33>C33,(B33+C33)/2,(2*B33+3*C33)/5),1) -> 27.8 | E33: SI
A34: POGGI ANTONELLA | B34: 19.1 | C34: - | D34: - | E34: -
A35: POLILLI EMIDIO | B35: 25.5 | C35: 24.4 | D35: =ROUND(IF(B35>C35,(B35+C35)/2,(2*B35+3*C35)/5),1) -> 25 | E35: SI
A36: PROIETTI ANGELO | B36: 18.8 | C36: 14.3 | D36: =ROUND(IF(B36>C36,(B36+C36)/2,(2*B36+3*C36)/5),1) -> 16.6 | E36: NO
A37: PUCCIO GIUSEPPE | B37: 30 | C37: 27 | D37: =ROUND(IF(B37>C37,(B37+C37)/2,(2*B37+3*C37)/5),1) -> 28.5 | E37: SI
A38: QUERZONI LEONARDO | B38: 25.9 | C38: 25.1 | D38: =ROUND(IF(B38>C38,(B38+C38)/2,(2*B38+3*C38)/5),1) -> 25.5 | E38: SI
A39: RAFFALDI ELISA VALERIA | B39: 25.5 | C39: 29.3 | D39: =ROUND(IF(B39>C39,(B39+C39)/2,(2*B39+3*C39)/5),1) -> 27.8 | E39: SI
A40: RICCI ERNESTO | B40: 28.9 | C40: 27.8 | D40: =ROUND(IF(B40>C40,(B40+C40)/2,(2*B40+3*C40)/5),1) -> 28.4 | E40: SI
A41: ROSSINI TERESA | B41: 21.4 | C41: - | D41: - | E41: -
A42: RUGGERO DARIO | B42: 24.4 | C42: 25.1 | D42: =ROUND(IF(B42>C42,(B42+C42)/2,(2*B42+3*C42)/5),1) -> 24.8 | E42: SI
A43: SABBATINI GUIDO | B43: 27 | C43: 25.9 | D43: =ROUND(IF(B43>C43,(B43+C43)/2,(2*B43+3*C43)/5),1) -> 26.5 | E43: SI
A44: SALUZ FEDERICO | B44: 12.8 | C44: 18.4 | D44: =ROUND(IF(B44>C44,(B44+C44)/2,(2*B44+3*C44)/5),1) -> 16.2 | E44: NO
A45: TAGLIAMONTE CRISTIANO | B45: 21.8 | C45: - | D45: - | E45: -
A46: TERELLA DAVIDE | B46: 24.8 | C46: 22.9 | D46: =ROUND(IF(B46>C46,(B46+C46)/2,(2*B46+3*C46)/5),1) -> 23.9 | E46: SI
A47: TRANQUILLI SALVATORE | B47: 22.5 | C47: 25.1 | D47: =ROUND(IF(B47>C47,(B47+C47)/2,(2*B47+3*C47)/5),1) -> 24.1 | E47: SI
A48: UGUAZIO GIORGIO | B48: 32.3 | C48: 35.6 | D48: =ROUND(IF(B48>C48,(B48+C48)/2,(2*B48+3*C48)/5),1) -> 34.3 | E48: SI
A49: VACCARO DOMENICO | B49: 25.5 | C49: 26.6 | D49: =ROUND(IF(B49>C49,(B49+C49)/2,(2*B49+3*C49)/5),1) -> 26.2 | E49: SI
A50: VALENZA ROMINA | B50: 19.9 | C50: 22.1 | D50: =ROUND(IF(B50>C50,(B50+C50)/2,(2*B50+3*C50)/5),1) -> 21.2 | E50: SI
A51: ZIPARO VITTORIO AMOS | B51: 32.3 | C51: 31.9 | D51: =ROUND(IF(B51>C51,(B51+C51)/2,(2*B51+3*C51)/5),1) -> 32.1 | E51: SI
A52: ZONA MARCO | B52: 25.5 | C52: 25.5 | D52: =ROUND(IF(B52>C52,(B52+C52)/2,(2*B52+3*C52)/5),1) -> 25.5 | E52: SI