B1: RISULTATI
B2: matricola | C2: cognome | D2: nome | E2: ES1 | F2: ES2 | G2: ES3 | H2: ES4 | I2: VOTO
A3: 1 | B3: 795555 | C3: AMENTA | D3: PATRIZIA | E3: 4 | F3: 4 | G3: 10 | H3: 7 | I3: =+E3+F3+G3+H3 -> 25 | J3: 0.60416666666666663
A4: 2 | B4: 9114007 | C4: ANGELOCOLA | D4: FABIO | E4: 5 | F4: 2 | G4: 10 | H4: 7 | I4: =+E4+F4+G4+H4 -> 24
A5: 3 | B5: 9118162 | C5: BACCI | D5: MARCO | E5: 5 | F5: 1.5 | G5: 10 | H5: 2.5 | I5: =+E5+F5+G5+H5 -> 19
A6: 4 | B6: 9117810 | C6: BALESTRA | D6: MICHELE | E6: 5 | F6: 4 | G6: 8.5 | H6: 0 | I6: =+E6+F6+G6+H6 -> 17.5
A7: 5 | B7: 9114771 | C7: BARBIERI | D7: PASQUALE | E7: 5 | F7: 2 | G7: 5 | H7: 0 | I7: =+E7+F7+G7+H7 -> 12
A8: 6 | B8: 795925 | C8: BARRA | D8: STANISLAO | E8: 5 | F8: 2 | G8: 5 | H8: 0 | I8: =+E8+F8+G8+H8 -> 12
A9: 7 | B9: 791006 | C9: BARTIROMO | D9: MARTA | E9: 5 | F9: 4 | G9: 11.5 | H9: 0.5 | I9: =+E9+F9+G9+H9 -> 21
A10: 8 | B10: 9103888 | C10: BRUNO | D10: ANTONINO | E10: 5 | F10: 4 | G10: 11.5 | H10: 7.5 | I10: =+E10+F10+G10+H10 -> 28
A11: 9 | B11: 795803 | C11: BRUSCHI | D11: GIOVANNI | E11: 5 | F11: 1.5 | G11: 1 | H11: 1 | I11: =+E11+F11+G11+H11 -> 8.5
A12: 10 | B12: 9114434 | C12: CALACCI | D12: GIOVANNI | E12: 5 | F12: 4 | G12: 12 | H12: 8 | I12: =+E12+F12+G12+H12 -> 29
A13: 11 | B13: 9113582 | C13: CALANDRA | D13: AZZURRA | E13: 5 | F13: 6 | G13: 12 | H13: 6 | I13: =+E13+F13+G13+H13 -> 29
A14: 12 | B14: 9118067 | C14: CALCINARI | D14: STEFANO | E14: 4.5 | F14: 4 | G14: 9 | H14: 3 | I14: =+E14+F14+G14+H14 -> 20.5
A15: 13 | B15: 9116895 | C15: CANDELA | D15: EMANUELE HERMES | E15: 5 | F15: 4 | G15: 12 | H15: 7.5 | I15: =+E15+F15+G15+H15 -> 28.5
A16: 14 | B16: 9105654 | C16: CAPINERA | D16: STEFANO | E16: 5 | F16: 4.5 | G16: 11.5 | H16: 7.5 | I16: =+E16+F16+G16+H16 -> 28.5
A17: 15 | B17: 9113557 | C17: CASSONI | D17: GIANCARLO | E17: 5 | F17: 6 | G17: 10 | H17: 3 | I17: =+E17+F17+G17+H17 -> 24 | J17: 0.625
A18: 16 | B18: 798301 | C18: CECILIA SANTAMARIA | D18: MARCO VALERIO | E18: 5 | F18: 4 | G18: 6 | H18: 6 | I18: =+E18+F18+G18+H18 -> 21
A19: 17 | B19: 9110086 | C19: CONTINO | D19: ROBERTA | E19: 5 | F19: 3.5 | G19: 11.5 | H19: 7 | I19: =+E19+F19+G19+H19 -> 27
A20: 18 | B20: 9114246 | C20: DABENE | D20: FRANCESCA | E20: 5 | F20: 4 | G20: 12 | H20: 7 | I20: =+E20+F20+G20+H20 -> 28
A21: 19 | B21: 9118089 | C21: DAGOSTINO | D21: DAIANA | E21: 5 | F21: 3.5 | G21: 9 | H21: 7 | I21: =+E21+F21+G21+H21 -> 24.5
A22: 20 | B22: 9116557 | C22: DI CARLO | D22: LORENZO | E22: 4.5 | F22: 2.5 | G22: 8 | H22: 0 | I22: =+E22+F22+G22+H22 -> 15
A23: 21 | B23: 9113345 | C23: DI CARO | D23: VINCENZO | E23: 5 | F23: 3.5 | G23: 7 | H23: 6.5 | I23: =+E23+F23+G23+H23 -> 22
A24: 22 | B24: 9113440 | C24: DI GENNARO | D24: GIACOMO | E24: 5 | F24: 3 | G24: 5 | I24: =+E24+F24+G24+H24 -> 13
A25: 23 | B25: 9111333 | C25: DIOTURNI | D25: MANUEL | E25: 4.5 | F25: 0.5 | G25: 12 | H25: 0.5 | I25: =+E25+F25+G25+H25 -> 17.5
A26: 24 | B26: 795575 | C26: FATIGATO | D26: FRANCESCA | E26: 5 | F26: 3 | G26: 11.5 | H26: 6.5 | I26: =+E26+F26+G26+H26 -> 26
A27: 25 | B27: 795538 | C27: FIORENZA | D27: JESSICA | E27: 5 | F27: 6 | G27: 12 | H27: 7 | I27: =+E27+F27+G27+H27 -> 30
A28: 26 | B28: 9114554 | C28: GIOVANNINI | D28: CINZIA | E28: 5 | F28: 4 | G28: 12 | H28: 8 | I28: =+E28+F28+G28+H28 -> 29
A29: 27 | B29: 792312 | C29: LOMBARDINI | D29: MARIA PAOLA | E29: 5 | F29: 6 | G29: 11 | H29: 6.5 | I29: =+E29+F29+G29+H29 -> 28.5
A30: 28 | B30: 9118165 | C30: MASOTINA | D30: MARCO | E30: 5 | F30: 5 | G30: 12 | H30: 0 | I30: =+E30+F30+G30+H30 -> 22
A31: 29 | B31: 9117305 | C31: MICHINI | D31: CARLA | E31: 5 | F31: 4 | G31: 12 | H31: 8 | I31: =+E31+F31+G31+H31 -> 29 | J31: 0.64583333333333337
A32: 30 | B32: 9117641 | C32: MOLINARIO | D32: IRENE | E32: 5 | F32: 4 | G32: 12 | H32: 8 | I32: =+E32+F32+G32+H32 -> 29
A33: 31 | B33: 9113554 | C33: NARDONE | D33: TOMMASO | E33: 5 | F33: 4 | G33: 12 | H33: 7.5 | I33: =+E33+F33+G33+H33 -> 28.5
A34: 32 | B34: 9117811 | C34: OROLOGIO | D34: SANDRA | E34: 5 | F34: 4 | G34: 10 | H34: 7 | I34: =+E34+F34+G34+H34 -> 26
A35: 33 | B35: 9109677 | C35: PELLICCIA | D35: FRANCESCA | E35: 5 | F35: 4 | G35: 8 | H35: 4 | I35: =+E35+F35+G35+H35 -> 21
A36: 34 | B36: 9119863 | C36: PELLICCIONI | D36: MARA | E36: 5 | F36: 2 | G36: 11 | H36: 2.5 | I36: =+E36+F36+G36+H36 -> 20.5
A37: 35 | B37: 796530 | C37: RAFFO | D37: FRANCESCA | E37: 5 | F37: 6 | G37: 12 | H37: 8 | I37: =+E37+F37+G37+H37 -> 31
A38: 36 | B38: 9111055 | C38: ROTA | D38: LAURA | E38: 5 | F38: 4 | G38: 5 | H38: 0 | I38: =+E38+F38+G38+H38 -> 14
A39: 37 | B39: 9116559 | C39: SALADINI | D39: LUDOVICO | E39: 5 | F39: 4 | G39: 12 | H39: 0 | I39: =+E39+F39+G39+H39 -> 21
A40: 38 | B40: 9117540 | C40: SALINARO | D40: MAURIZIO | E40: 5 | F40: 2 | G40: 6 | H40: 7 | I40: =+E40+F40+G40+H40 -> 20
A41: 39 | B41: 796639 | C41: SPAGNOL | D41: BARBARA | E41: 5 | F41: 4 | G41: 9 | H41: 7 | I41: =+E41+F41+G41+H41 -> 25
A42: 40 | B42: 9116234 | C42: VALLERIANI | D42: MARCO | E42: 2 | F42: 2 | G42: 12 | H42: 0 | I42: =+E42+F42+G42+H42 -> 16
A43: 41 | B43: 9115169 | C43: VICARI | D43: FLAVIA | E43: 5 | F43: 6 | G43: 12 | H43: 8 | I43: =+E43+F43+G43+H43 -> 31
A44: 42 | B44: 9116659 | C44: VIDOR | D44: GIANMARIA | E44: 5 | F44: 4 | G44: 12 | H44: 0 | I44: =+E44+F44+G44+H44 -> 21