A1: Audisio | B1: Virgilio | C1: =SUM(C1:F1) -> 29
A2: Avolio | B2: Corrado | C2: =SUM(C2:F2) -> 23
A3: Bianchini | B3: Alessio | C3: =SUM(C3:F3) -> 25
A4: Bonfiglio | B4: Cosimo | C4: =SUM(C4:F4) -> 26
A5: Bracciale | B5: Andrea | C5: =SUM(C5:F5) -> 23
A6: Brizi | B6: Daniele | C6: =SUM(C6:F6) -> 30
A7: Canale | B7: Enrico | C7: =SUM(C7:F7) -> 27
A8: Cassis | B8: Giuliano | C8: =SUM(C8:F8) -> 30
A9: Cecchi | B9: Simone | C9: =SUM(C9:F9) -> 30
A10: Cervone | B10: Antonello | C10: =SUM(C10:F10) -> 27
A11: Ciacelli | B11: Daniele | C11: =SUM(C11:F11) -> 26
A12: Clementi | B12: Alessia | C12: =SUM(C12:F12) -> 30
A13: Colecchia | B13: Paolo | C13: =SUM(C13:F13) -> 20
A14: Conventi | B14: Maurizio | C14: =SUM(C14:F14) -> 30
A15: Crociani | B15: Carlo | C15: =SUM(C15:F15) -> 30
A16: Cucuzzo | B16: Diego | C16: =SUM(C16:F16) -> 24
A17: Dastoli | B17: Domenico | C17: =SUM(C17:F17) -> 30
A18: De Martino | B18: Giacomo | C18: =SUM(C18:F18) -> 30
A19: Del Romano | B19: Marco | C19: =SUM(C19:F19) -> 30
A20: Di Domenico | B20: Alessandra | C20: =SUM(C20:F20) -> 30
A21: Di Gioia | B21: Matteo | C21: =SUM(C21:F21) -> 30
A22: Di Girolamo | B22: Alessio | C22: =SUM(C22:F22) -> 30
A23: Di Mario | B23: Lorenzo | C23: =SUM(C23:F23) -> 26
A24: Dionisi | B24: Alessandro | C24: =SUM(C24:F24) -> 28
A25: Dioturni | B25: Manuel | C25: =SUM(C25:F25) -> 25
A26: Egidio | B26: Luca | C26: =SUM(C26:F26) -> 30
A27: Fiorucci | B27: Fabio | C27: =SUM(C27:F27) -> 30
A28: Guerrera | B28: Gianpiero | C28: =SUM(C28:F28) -> 26
A29: Guerrieri | B29: Mauro | C29: =SUM(C29:F29) -> 26
A30: Guglielmi | B30: Pietro | C30: =SUM(C30:F30) -> 26
A31: Jiritano | B31: Ivan | C31: =SUM(C31:F31) -> 30
A32: La Manna | B32: Antonello | C32: =SUM(C32:F32) -> 29
A33: Lanni | B33: Leonardo | C33: =SUM(C33:F33) -> 24
A34: Laurenzi | B34: Giancarlo | C34: =SUM(C34:F34) -> 29
A35: Lauria | B35: Gianluca | C35: =SUM(C35:F35) -> 29
A36: Louvosso Nzenze | B36: Jean Frederic | C36: =SUM(C36:F36) -> 21
A37: Malpassini | B37: Davide | C37: =SUM(C37:F37) -> 30
A38: Mambrini | B38: Eleonora | C38: =SUM(C38:F38) -> 21
A39: Mancaniello | B39: Canio | C39: =SUM(C39:F39) -> 18
A40: Marzocchini | B40: Simone | C40: =SUM(C40:F40) -> 28
A41: Marzotti | B41: Manuela | C41: =SUM(C41:F41) -> 25
A42: Maura | B42: Veronica | C42: =SUM(C42:F42) -> 21
A43: Migliacci | B43: Davide | C43: =SUM(C43:F43) -> 22
A44: Milano | B44: Giovanni | C44: =SUM(C44:F44) -> 30
A45: Monti | B45: Mauro | C45: =SUM(C45:F45) -> 26
A46: Montori | B46: Federico | C46: =SUM(C46:F46) -> 30
A47: Nardini | B47: Cristina | C47: =SUM(C47:F47) -> 27
A48: Nobile | B48: Diego | C48: =SUM(C48:F48) -> 27
A49: Pennica | B49: Gianluca | C49: =SUM(C49:F49) -> 30
A50: Perrotta | B50: Elisa | C50: =SUM(C50:F50) -> 30
A51: Pezzullo | B51: Alessandro | C51: =SUM(C51:F51) -> 30
A52: Ponziani | B52: Claudio | C52: =SUM(C52:F52) -> 28
A53: Proietto | B53: Daniele | C53: =SUM(C53:F53) -> 24
A54: Quarto | B54: Giuliano | C54: =SUM(C54:F54) -> 30
A55: Rayes | B55: Nadia | C55: =SUM(C55:F55) -> 26
A56: Ricci | B56: Stefano | C56: =SUM(C56:F56) -> 30
A57: Ritucci | B57: Angelo | C57: =SUM(C57:F57) -> 20
A58: Romeo | B58: Antonio | C58: =SUM(C58:F58) -> 30
A59: Rughetti | B59: Diego | C59: =SUM(C59:F59) -> 25
A60: Salza | B60: Filippo | C60: =SUM(C60:F60) -> 27
A61: Sciannelli | B61: Maria | C61: =SUM(C61:F61) -> 26
A62: Selis | B62: Maddalena | C62: =SUM(C62:F62) -> 30
A63: Stacklies | B63: Sibylle | C63: =SUM(C63:F63) -> 28
A64: Stellato | B64: Giovanni | C64: =SUM(C64:F64) -> 27
A65: Tipaldi | B65: Gian Diego | C65: =SUM(C65:F65) -> 27
A66: Tullio | B66: Luigi | C66: =SUM(C66:F66) -> 19
A67: Vetrini | B67: Stefano | C67: =SUM(C67:F67) -> 26
A68: Viscione | B68: Sabrina | C68: =SUM(C68:F68) -> 25

C1: Amicone | D1: Ines loretta | E1: =SUM(E1:H1) -> 28
C2: Colognesi | D2: Elisa | E2: =SUM(E2:H2) -> 30
C3: D'Andreagiovanni | D3: Fabio | E3: =SUM(E3:H3) -> 30
C4: De Masi | D4: Massimiliano | E4: =SUM(E4:H4) -> 27
C5: Falcioni | D5: Zuleika | E5: =SUM(E5:H5) -> 30
C6: Imperioli | D6: Daiana | E6: =SUM(E6:H6) -> 30
C7: Pini | D7: Marco | E7: =SUM(E7:H7) -> 28
C8: Ranalletta | D8: Carolina | E8: =SUM(E8:H8) -> 24
C9: Rolli | D9: Alessandro | E9: =SUM(E9:H9) -> 25
C10: Ventura | D10: Michele | E10: =SUM(E10:H10) -> 30